id,conversation_id,created_at,date,time,timezone,user_id,username,name,place,tweet,language,mentions,urls,photos,replies_count,retweets_count,likes_count,hashtags,cashtags,link,retweet,quote_url,video,thumbnail,near,geo,source,user_rt_id,user_rt,retweet_id,reply_to,retweet_date,translate,trans_src,trans_dest
1088439392010674177,1088439392010674177,2019-01-24 17:12:27 MSK,2019-01-24,17:12:27,+0300,153812887,medvedevrussia,Дмитрий Медведев,,"Никто не имеет права незаконными методами отстранить от власти главу государства, который недавно победил на выборах (независимо от того, нравится этот человек тем или иным странам или политическим силам или нет) #Венесуэла",ru,[],[],[],1192,308,1152,['венесуэла'],[],https://twitter.com/MedvedevRussia/status/1088439392010674177,False,,0,,,,,,,,[],,,,
1088439276575051777,1088439276575051777,2019-01-24 17:12:00 MSK,2019-01-24,17:12:00,+0300,153812887,medvedevrussia,Дмитрий Медведев,,"Мы стали свидетелями того, как на площади в очередной раз вопреки конституции «выбирается» другой глава государства. Причем этот квазипереворот поддерживают главы ряда стран. Очень быстро. Как по команде #Венесуэла",ru,[],[],[],1574,306,1026,['венесуэла'],[],https://twitter.com/MedvedevRussia/status/1088439276575051777,False,,0,,,,,,,,[],,,,
1088394490111508480,1088394490111508480,2019-01-24 14:14:02 MSK,2019-01-24,14:14:02,+0300,153812887,medvedevrussia,Дмитрий Медведев,,"Совсем скоро #Красноярск примет Всемирную зимнюю универсиаду. Она стартует 2 марта. Мы построили или кардинально реконструировали больше 30 спортивных объектов, подготовили город к встрече более 110 тысяч гостей из разных стран. Уверен, все пройдет на самом высоком уровне",ru,[],[],[],198,58,314,['красноярск'],[],https://twitter.com/MedvedevRussia/status/1088394490111508480,False,,0,,,,,,,,[],,,,
1088381524972634112,1088381524972634112,2019-01-24 13:22:31 MSK,2019-01-24,13:22:31,+0300,153812887,medvedevrussia,Дмитрий Медведев,,Правительство продолжает оказывать помощь пострадавшим жителям многоквартирного дома в Магнитогорске. На расселение дома из резервного фонда будет выделено около 500 млн рублей,ru,[],[],[],166,51,298,[],[],https://twitter.com/MedvedevRussia/status/1088381524972634112,False,,0,,,,,,,,[],,,,
1088041770007625730,1088041770007625730,2019-01-23 14:52:27 MSK,2019-01-23,14:52:27,+0300,153812887,medvedevrussia,Дмитрий Медведев,,"Россия может быть успешной в ракетно-космической отрасли. Но пока в этой сфере есть проблемы. Будет усилен контроль за исполнением принятых решений. За расходами, сроками и качеством выполнения работ. Исполнителям пора заканчивать с прожектерством. Меньше говорить, больше делать",ru,[],[],[],900,190,830,[],[],https://twitter.com/MedvedevRussia/status/1088041770007625730,False,,0,,,,,,,,[],,,,
1086180861635121152,1086180861635121152,2019-01-18 11:37:52 MSK,2019-01-18,11:37:52,+0300,153812887,medvedevrussia,Дмитрий Медведев,,"Компетенции министерства по развитию Дальнего Востока дополнятся вопросами, связанными с Арктикой. Будет введена должность первого заместителя министра, непосредственно отвечающего за развитие Арктической зоны  https://t.co/dJPDB04qGd  https://t.co/P4t7cXjU6E",ru,[],['http://government.ru/news/35425/'],['https://pbs.twimg.com/media/DxLjr1TWwAAyfjd.jpg'],224,59,273,[],[],https://twitter.com/MedvedevRussia/status/1086180861635121152,False,,1,https://pbs.twimg.com/media/DxLjr1TWwAAyfjd.jpg,,,,,,,[],,,,
1085851577817227264,1085851577817227264,2019-01-17 13:49:24 MSK,2019-01-17,13:49:24,+0300,153812887,medvedevrussia,Дмитрий Медведев,,Утвержден план трансформации делового климата. Правительство продолжает работу по сокращению избыточных процедур для бизнеса  https://t.co/ygRjxZ0ERj,ru,[],['http://government.ru/news/35414/'],[],194,38,164,[],[],https://twitter.com/MedvedevRussia/status/1085851577817227264,False,,0,,,,,,,,[],,,,
1085541710413922304,1085541710413922304,2019-01-16 17:18:06 MSK,2019-01-16,17:18:06,+0300,153812887,medvedevrussia,Дмитрий Медведев,,Определен состав российской делегации на Всемирном экономическом форуме в Давосе. Ее возглавит министр экономического развития Максим Орешкин,ru,[],[],[],297,60,347,[],[],https://twitter.com/MedvedevRussia/status/1085541710413922304,False,,0,,,,,,,,[],,,,
1084498626934722560,1084498626934722560,2019-01-13 20:13:16 MSK,2019-01-13,20:13:16,+0300,153812887,medvedevrussia,Дмитрий Медведев,,Поздравляю мужскую и женскую сборные России с блестящим выступлением на Кубке мира по биатлону в Оберхофе! Молодцы!,ru,[],[],[],228,189,1516,[],[],https://twitter.com/MedvedevRussia/status/1084498626934722560,False,,0,,,,,,,,[],,,,
1082040633504747520,1082040633504747520,2019-01-07 01:26:05 MSK,2019-01-07,01:26:05,+0300,153812887,medvedevrussia,Дмитрий Медведев,,С Рождеством Христовым!  https://t.co/5CS9we5cHH,ru,[],[],['https://pbs.twimg.com/media/DwQuMTkX4AAUHUj.jpg'],394,290,1734,[],[],https://twitter.com/MedvedevRussia/status/1082040633504747520,False,,1,https://pbs.twimg.com/media/DwQuMTkX4AAUHUj.jpg,,,,,,,[],,,,
1081564315633831936,1081564315633831936,2019-01-05 17:53:21 MSK,2019-01-05,17:53:21,+0300,153812887,medvedevrussia,Дмитрий Медведев,,Подписано распоряжение о выплатах и пособиях семьям погибших и пострадавшим в результате обрушения жилого дома в Магнитогорске. На эти цели из резервного фонда правительства будет выделено около 65 млн рублей,ru,[],[],[],319,131,644,[],[],https://twitter.com/MedvedevRussia/status/1081564315633831936,False,,0,,,,,,,,[],,,,
1079815618709389312,1079815618709389312,2018-12-31 22:04:40 MSK,2018-12-31,22:04:40,+0300,153812887,medvedevrussia,Дмитрий Медведев,,"С Новым, 2019 годом!  https://t.co/0DsE8I2xGs",ru,[],[],[],1244,481,2706,[],[],https://twitter.com/MedvedevRussia/status/1079815618709389312,False,,1,https://pbs.twimg.com/ext_tw_video_thumb/1079814018884354053/pu/img/5FyJc5XFzidAReAl.jpg,,,,,,,[],,,,
1079690889621131264,1079690889621131264,2018-12-31 13:49:02 MSK,2018-12-31,13:49:02,+0300,153812887,medvedevrussia,Дмитрий Медведев,,Глубокие соболезнования родным и близким погибших при взрыве газа в жилом доме в Магнитогорске. Правительство России окажет всю необходимую поддержку пострадавшим и семьям погибших. #Магнитогорск,ru,[],[],[],254,173,741,['магнитогорск'],[],https://twitter.com/MedvedevRussia/status/1079690889621131264,False,,0,,,,,,,,[],,,,
1078957430061572096,1078957430061572096,2018-12-29 13:14:32 MSK,2018-12-29,13:14:32,+0300,153812887,medvedevrussia,Дмитрий Медведев,,Россия вводит запрет на импорт ряда украинских товаров. Это – ответная мера на санкционные ограничения со стороны Украины. Подписал соответствующее постановление,ru,[],[],[],645,243,1257,[],[],https://twitter.com/MedvedevRussia/status/1078957430061572096,False,,0,,,,,,,,[],,,,
1077913456890863616,1077913456890863616,2018-12-26 16:06:09 MSK,2018-12-26,16:06:09,+0300,153812887,medvedevrussia,Дмитрий Медведев,,"Встреча правительства с Президентом в конце года – хорошая традиция, которую мы очень ценим. Благодарен Владимиру Владимировичу Путину за оценку работы и то доверие, которое оказано правительству. Мы будем работать над достижением целей, поставленных в указе Президента  https://t.co/JcMcBnJtzM",ru,[],[],"['https://pbs.twimg.com/media/DvWEYIBWoAAVw41.jpg', 'https://pbs.twimg.com/media/DvWEYHzWsAEFmuF.jpg', 'https://pbs.twimg.com/media/DvWEYH9WwAAZUuS.jpg', 'https://pbs.twimg.com/media/DvWEYH9W0AAyeHA.jpg']",394,131,550,[],[],https://twitter.com/MedvedevRussia/status/1077913456890863616,False,,1,https://pbs.twimg.com/media/DvWEYIBWoAAVw41.jpg,,,,,,,[],,,,
1077528876929167360,1077528876929167360,2018-12-25 14:37:58 MSK,2018-12-25,14:37:58,+0300,153812887,medvedevrussia,Дмитрий Медведев,,"Список физических и юридических лиц Украины, в отношении которых будут применяться специальные ограничительные меры, расширен. Я подписал соответствующее постановление. Это сделано для защиты интересов российского государства, компаний и граждан России",ru,[],[],[],630,217,920,[],[],https://twitter.com/MedvedevRussia/status/1077528876929167360,False,,0,,,,,,,,[],,,,
1074325568806666242,1074325568806666242,2018-12-16 18:29:10 MSK,2018-12-16,18:29:10,+0300,153812887,medvedevrussia,Дмитрий Медведев,,"По предварительным данным, на выборах губернатора Приморья побеждает Олег Кожемяко. Поздравляю с этим результатом",ru,[],[],[],510,77,481,[],[],https://twitter.com/MedvedevRussia/status/1074325568806666242,False,,0,,,,,,,,[],,,,
1073237028840583174,1073237028840583174,2018-12-13 18:23:42 MSK,2018-12-13,18:23:42,+0300,153812887,medvedevrussia,Дмитрий Медведев,,"Мы готовы и дальше продвигаться по пути строительства Союзного государства. Включая создание единого эмиссионного центра, единой таможенной службы, суда и счетной палаты. В этом случае будет проводиться единая политика в области цено- и  тарифообразования  https://t.co/3718WyDiuc",ru,[],['http://government.ru/news/35083/'],[],165,49,190,[],[],https://twitter.com/MedvedevRussia/status/1073237028840583174,False,,0,,,,,,,,[],,,,
1072782618360467457,1072782618360467457,2018-12-12 12:18:02 MSK,2018-12-12,12:18:02,+0300,153812887,medvedevrussia,Дмитрий Медведев,,"Сегодня мы отмечаем 25-летие новой Конституции России. Казалось бы, четверть века – скромный срок по меркам истории российского права. Однако Конституция ценна не годами, а идеями.   https://t.co/jNqBkTR4qb",ru,[],['http://government.ru/news/35053/'],[],289,55,240,[],[],https://twitter.com/MedvedevRussia/status/1072782618360467457,False,,0,,,,,,,,[],,,,
1070653151177596930,1070653151177596930,2018-12-06 15:16:17 MSK,2018-12-06,15:16:17,+0300,153812887,medvedevrussia,Дмитрий Медведев,,Ответил на вопросы журналистов пяти российских телеканалов. Спасибо за интересную беседу!  https://t.co/YlcVsrsozK  https://t.co/VwfmRpUOZD,ru,[],['https://www.youtube.com/watch?v=0VxkIGcYqYc'],['https://pbs.twimg.com/media/Dtu5WQfWkAEhUUo.jpg'],398,70,340,[],[],https://twitter.com/MedvedevRussia/status/1070653151177596930,False,,1,https://pbs.twimg.com/media/Dtu5WQfWkAEhUUo.jpg,,,,,,,[],,,,
1070271577516900353,1070271577516900353,2018-12-05 14:00:03 MSK,2018-12-05,14:00:03,+0300,153812887,medvedevrussia,Дмитрий Медведев,,"Для развития общественных и пешеходных пространств и безопасности дорожного движения в ряде случаев будет обеспечен приоритет велосипедистам, введены новые дорожные знаки и разметка. Такие меры содержатся в новом постановлении правительства",ru,[],[],[],278,89,495,[],[],https://twitter.com/MedvedevRussia/status/1070271577516900353,False,,0,,,,,,,,[],,,,
1067736648664997889,1067736648664997889,2018-11-28 14:07:09 MSK,2018-11-28,14:07:09,+0300,153812887,medvedevrussia,Дмитрий Медведев,,"Очевидно, что президент Порошенко не имеет шансов при нынешнем раскладе победить на выборах и даже, может быть, не имеет шансов на второй тур. И чтобы добиться выгодных для него решений, и была, вероятно, предпринята эта провокация в Керченском проливе  https://t.co/TP5iWjyRN5",ru,[],['http://government.ru/news/34850/#34857-begin'],[],302,50,248,[],[],https://twitter.com/MedvedevRussia/status/1067736648664997889,False,,0,,,,,,,,[],,,,
1067735370933129217,1067735370933129217,2018-11-28 14:02:04 MSK,2018-11-28,14:02:04,+0300,153812887,medvedevrussia,Дмитрий Медведев,,По поводу инцидента в Керченском проливе – вчера этот вопрос мне был задан после переговоров:  https://t.co/TP5iWjyRN5,ru,[],['http://government.ru/news/34850/#34857-begin'],[],35,13,86,[],[],https://twitter.com/MedvedevRussia/status/1067735370933129217,False,,0,,,,,,,,[],,,,
1065253621414137856,1065253621414137856,2018-11-21 17:40:29 MSK,2018-11-21,17:40:29,+0300,153812887,medvedevrussia,Дмитрий Медведев,,Утвердил временный порядок ввоза на территорию России подержанных праворульных автомобилей для жителей ДФО. В течение года можно будет ввозить одно транспортное средство без установки на него аппаратуры системы «ЭРА-ГЛОНАСС».,ru,[],[],[],256,81,347,[],[],https://twitter.com/MedvedevRussia/status/1065253621414137856,False,,0,,,,,,,,[],,,,
1058977197996851201,1058977197996851201,2018-11-04 10:00:13 MSK,2018-11-04,10:00:13,+0300,153812887,medvedevrussia,Дмитрий Медведев,,"С праздником, с Днем народного единства!  https://t.co/MZNAWkS6lV",ru,[],[],['https://pbs.twimg.com/media/DrI6YyuWsAIsHE3.jpg'],798,260,1602,[],[],https://twitter.com/MedvedevRussia/status/1058977197996851201,False,,1,https://pbs.twimg.com/media/DrI6YyuWsAIsHE3.jpg,,,,,,,[],,,,
1047518347875835904,1047518347875835904,2018-10-03 19:06:50 MSK,2018-10-03,19:06:50,+0300,153812887,medvedevrussia,Дмитрий Медведев,,"Поздравляю Международную шахматную федерацию с избранием нового президента! Желаю удачи, @advorkovich! @FIDE_chess",ru,"[{'screen_name': 'advorkovich', 'name': 'arkady dvorkovich', 'id': '117666012'}, {'screen_name': 'fide_chess', 'name': 'international chess federation', 'id': '249601765'}]",[],[],175,58,368,[],[],https://twitter.com/MedvedevRussia/status/1047518347875835904,False,,0,,,,,,,,[],,,,
1040680875598462976,1040680875598462976,2018-09-14 22:17:10 MSK,2018-09-14,22:17:10,+0300,153812887,medvedevrussia,Дмитрий Медведев,,"Спасибо всем, кто поздравил меня с Днём рождения!  https://t.co/1QGOaq3M6s",ru,[],[],"['https://pbs.twimg.com/media/DnE9vDzXoAEPWqy.jpg', 'https://pbs.twimg.com/media/DnE9vD5WwAAKb_G.jpg']",1038,312,2596,[],[],https://twitter.com/MedvedevRussia/status/1040680875598462976,False,,1,https://pbs.twimg.com/media/DnE9vDzXoAEPWqy.jpg,,,,,,,[],,,,
1035877839327911936,1035877839327911936,2018-09-01 16:11:37 MSK,2018-09-01,16:11:37,+0300,153812887,medvedevrussia,Дмитрий Медведев,,С Днем знаний и началом учебного года!  https://t.co/Cvm0Q8S9Ld,ru,[],[],['https://pbs.twimg.com/media/DmAtYqjXcAAfOTW.jpg'],279,71,598,[],[],https://twitter.com/MedvedevRussia/status/1035877839327911936,False,,1,https://pbs.twimg.com/media/DmAtYqjXcAAfOTW.jpg,,,,,,,[],,,,
1026728422125527040,1026728422125527040,2018-08-07 10:15:06 MSK,2018-08-07,10:15:06,+0300,153812887,medvedevrussia,Дмитрий Медведев,,"Отношения с Западом можно реанимировать. Осознание, что дружить лучше, приходит к нашим партнерам",ru,[],[],[],498,100,393,[],[],https://twitter.com/MedvedevRussia/status/1026728422125527040,False,,0,,,,,,,,[],,,,
1026727604299161600,1026727604299161600,2018-08-07 10:11:51 MSK,2018-08-07,10:11:51,+0300,153812887,medvedevrussia,Дмитрий Медведев,,"НАТО, что бы ни говорили в альянсе, рассматривает Россию как потенциального противника. Их ядерная триада нацелена на нас – это, к сожалению, факт. Нам есть что противопоставить в этой ситуации",ru,[],[],[],428,106,488,[],[],https://twitter.com/MedvedevRussia/status/1026727604299161600,False,,0,,,,,,,,[],,,,
1026726782257516544,1026726782257516544,2018-08-07 10:08:35 MSK,2018-08-07,10:08:35,+0300,153812887,medvedevrussia,Дмитрий Медведев,,"В результате операции по «принуждению Грузии к миру» Россия получила главное – мир. Мы смогли защитить своих граждан, которые живут и в Абхазии, и в Южной Осетии",ru,[],[],[],184,82,382,[],[],https://twitter.com/MedvedevRussia/status/1026726782257516544,False,,0,,,,,,,,[],,,,
1026725741784965120,1026725741784965120,2018-08-07 10:04:27 MSK,2018-08-07,10:04:27,+0300,153812887,medvedevrussia,Дмитрий Медведев,,"10 лет грузино-югоосетинскому конфликту. В интервью газете «Коммерсантъ» рассказал о событиях августа 2008-го, их предыстории и текущих российско-грузинских отношениях  https://t.co/ep7vR31HSh",ru,[],['https://youtu.be/7JDd1ZCmXZM'],[],83,75,212,[],[],https://twitter.com/MedvedevRussia/status/1026725741784965120,False,,0,,,,,,,,[],,,,
1018563355152351234,1018563355152351234,2018-07-15 21:30:02 MSK,2018-07-15,21:30:02,+0300,153812887,medvedevrussia,Дмитрий Медведев,,Великолепный финал! Франция - чемпион. Россия провела лучший Чемпионат мира по футболу!  https://t.co/jS0GXqUH9L,ru,[],[],"['https://pbs.twimg.com/media/DiKp9lGW0AE6KTI.jpg', 'https://pbs.twimg.com/media/DiKp9luX4AAV874.jpg', 'https://pbs.twimg.com/media/DiKp9l2WAAElCGI.jpg']",348,273,1769,[],[],https://twitter.com/MedvedevRussia/status/1018563355152351234,False,,1,https://pbs.twimg.com/media/DiKp9lGW0AE6KTI.jpg,,,,,,,[],,,,
1015706352646283264,1015706352646283264,2018-07-08 00:17:20 MSK,2018-07-08,00:17:20,+0300,153812887,medvedevrussia,Дмитрий Медведев,,Огромное спасибо сборной России за игру на этом чемпионате в России  https://t.co/slvCBrPs14,ru,[],[],[],458,410,2576,[],[],https://twitter.com/MedvedevRussia/status/1015706352646283264,False,,1,https://pbs.twimg.com/ext_tw_video_thumb/1015706267912933385/pu/img/kmrphMT_32BwicV7.jpg,,,,,,,[],,,,
1013517191126441984,1013517191126441984,2018-07-01 23:18:23 MSK,2018-07-01,23:18:23,+0300,153812887,medvedevrussia,Дмитрий Медведев,,"Ребята – молодцы! #Россия, вперед!  https://t.co/DLQDU1oDO1",ru,[],[],['https://pbs.twimg.com/media/DhC8cQhX0AEX3Cs.jpg'],200,149,1138,['россия'],[],https://twitter.com/MedvedevRussia/status/1013517191126441984,False,,1,https://pbs.twimg.com/media/DhC8cQhX0AEX3Cs.jpg,,,,,,,[],,,,
1013471877967335424,1013471877967335424,2018-07-01 20:18:19 MSK,2018-07-01,20:18:19,+0300,153812887,medvedevrussia,Дмитрий Медведев,,Наша сборная в 1/4 финала. МОЛОДЦЫ!  https://t.co/003S9WNv3T,ru,[],[],['https://pbs.twimg.com/media/DhCTRwrXkAActUQ.jpg'],306,335,2401,[],[],https://twitter.com/MedvedevRussia/status/1013471877967335424,False,,1,https://pbs.twimg.com/media/DhCTRwrXkAActUQ.jpg,,,,,,,[],,,,
1010118092737994754,1010118092737994754,2018-06-22 14:11:35 MSK,2018-06-22,14:11:35,+0300,153812887,medvedevrussia,Дмитрий Медведев,,22 июня – День памяти и скорби  https://t.co/yrEBMUNihC,ru,[],[],"['https://pbs.twimg.com/media/DgSok1nWsAAXA_6.jpg', 'https://pbs.twimg.com/media/DgSok1sX4AABT8e.jpg', 'https://pbs.twimg.com/media/DgSok1yXkAACX56.jpg', 'https://pbs.twimg.com/media/DgSok1vWAAA1eeD.jpg']",131,99,421,[],[],https://twitter.com/MedvedevRussia/status/1010118092737994754,False,,1,https://pbs.twimg.com/media/DgSok1nWsAAXA_6.jpg,,,,,,,[],,,,
1007328467309023232,1007328467309023232,2018-06-14 21:26:36 MSK,2018-06-14,21:26:36,+0300,153812887,medvedevrussia,Дмитрий Медведев,,Россия – Саудовская Аравия: 5-0! Победа!  https://t.co/XFUAgiV0R0,ru,[],[],"['https://pbs.twimg.com/media/Dfq_3_XWkAEBAd8.jpg', 'https://pbs.twimg.com/media/Dfq_3_mWAAcnjVR.jpg']",490,189,1346,[],[],https://twitter.com/MedvedevRussia/status/1007328467309023232,False,,1,https://pbs.twimg.com/media/Dfq_3_XWkAEBAd8.jpg,,,,,,,[],,,,
1006433736559415296,1006433736559415296,2018-06-12 10:11:16 MSK,2018-06-12,10:11:16,+0300,153812887,medvedevrussia,Дмитрий Медведев,,С Днём России!  https://t.co/89TDse2srW,ru,[],[],"['https://pbs.twimg.com/media/DfeR3vtW4AEbmMb.jpg', 'https://pbs.twimg.com/media/DfeR3vvWkAA8ts2.jpg']",463,257,1622,[],[],https://twitter.com/MedvedevRussia/status/1006433736559415296,False,,1,https://pbs.twimg.com/media/DfeR3vtW4AEbmMb.jpg,,,,,,,[],,,,
997447353694081024,997447353694081024,2018-05-18 15:02:35 MSK,2018-05-18,15:02:35,+0300,153812887,medvedevrussia,Дмитрий Медведев,,Представил Президенту предложения по кадровому составу нового правительства  https://t.co/6cc2uE0gip  https://t.co/l4RGl0yyrZ,ru,[],['http://government.ru/news/32597'],['https://pbs.twimg.com/media/DdelCAAUwAI5akR.jpg'],257,122,262,[],[],https://twitter.com/MedvedevRussia/status/997447353694081024,False,,1,https://pbs.twimg.com/media/DdelCAAUwAI5akR.jpg,,,,,,,[],,,,
996458948994748417,996458948994748417,2018-05-15 21:35:01 MSK,2018-05-15,21:35:01,+0300,153812887,medvedevrussia,Дмитрий Медведев,,Представил Президенту предложения по структуре нового правительства  https://t.co/9dJrFechDA  https://t.co/Bjw3URuKgo,ru,[],['http://government.ru/news/32589/'],['https://pbs.twimg.com/media/DdQiHXDX0AEXPOk.jpg'],202,77,306,[],[],https://twitter.com/MedvedevRussia/status/996458948994748417,False,,1,https://pbs.twimg.com/media/DdQiHXDX0AEXPOk.jpg,,,,,,,[],,,,
994200529592045569,994200529592045569,2018-05-09 16:00:52 MSK,2018-05-09,16:00:52,+0300,153812887,medvedevrussia,Дмитрий Медведев,,Два моих деда – Афанасий Медведев и Вениамин Шапошников  https://t.co/w14lDpT7gS,ru,[],[],['https://pbs.twimg.com/media/DcwcF2rW0AAtQcr.jpg'],285,211,1574,[],[],https://twitter.com/MedvedevRussia/status/994200529592045569,False,,1,https://pbs.twimg.com/media/DcwcF2rW0AAtQcr.jpg,,,,,,,[],,,,
