id,conversation_id,created_at,date,time,timezone,user_id,username,name,place,tweet,language,mentions,urls,photos,replies_count,retweets_count,likes_count,hashtags,cashtags,link,retweet,quote_url,video,thumbnail,near,geo,source,user_rt_id,user_rt,retweet_id,reply_to,retweet_date,translate,trans_src,trans_dest
1597949548407975936,1597949548407975936,2022-11-30 16:43:55 MSK,2022-11-30,16:43:55,+0300,153812887,medvedevrussia,Дмитрий Медведев,,"Неистовая тётка Урсула сообщила миру о «стотысячных потерях» ВСУ в своём твиттере. Сообщение потёрли и отредактировали. Очевидно, что тётушке прилетело по голове из вашингтонского обкома. Прилетело, похоже, больно. Выглядит крайне унизительно. Нет никакого ЕС, есть штат номер 51",ru,[],[],[],592,530,2281,[],[],https://twitter.com/MedvedevRussia/status/1597949548407975936,False,,0,,,,,,,,[],,,,
1597226683068993537,1597226683068993537,2022-11-28 16:51:30 MSK,2022-11-28,16:51:30,+0300,153812887,medvedevrussia,Дмитрий Медведев,,Украинские курильщики продолжают грезить прямыми видеовключениями из Ялты и других мест. Можно организовать такое. Прямо из СИЗО в Крыму. Хотя наиболее продвинутым получится организовать сеанс связи из «Лефортово»,ru,[],[],[],432,324,1535,[],[],https://twitter.com/MedvedevRussia/status/1597226683068993537,False,,0,,,,,,,,[],,,,
1594674822239469568,1594674822239469568,2022-11-21 15:51:19 MSK,2022-11-21,15:51:19,+0300,153812887,medvedevrussia,Дмитрий Медведев,,"На встрече с президентом Кубы Мигелем Диас-Канелем обсудили вопросы сотрудничества в области безопасности, расширение межпартийного взаимодействия, совместную работу по противодействию беспрецедентному санкционному давлению, с которым сталкиваются наши страны  https://t.co/lPIUWM6dkA",ru,[],[],['https://pbs.twimg.com/media/FiFsRPfXkAEcaDX.jpg'],224,280,990,[],[],https://twitter.com/MedvedevRussia/status/1594674822239469568,False,,1,https://pbs.twimg.com/media/FiFsRPfXkAEcaDX.jpg,,,,,,,[],,,,
1592775492381593600,1592775492381593600,2022-11-16 10:04:04 MSK,2022-11-16,10:04:04,+0300,153812887,medvedevrussia,Дмитрий Медведев,,История с украинским «ракетным ударом» по польской ферме доказывает лишь одно: Запад своей гибридной войной с Россией повышает вероятность начала войны мировой.,ru,[],[],[],884,333,1652,[],[],https://twitter.com/MedvedevRussia/status/1592775492381593600,False,,0,,,,,,,,[],,,,
1586041592384659456,1586041586492002304,2022-10-28 20:05:57 MSK,2022-10-28,20:05:57,+0300,153812887,medvedevrussia,Дмитрий Медведев,,"Либо сказать, чтобы они подтёрлись своим поганым расчётом. Известно, что из-за санкций туалетная бумага в ЕС сильно подорожала.",ru,[],[],[],252,148,1136,[],[],https://twitter.com/MedvedevRussia/status/1586041592384659456,False,,0,,,,,,,,[],,,,
1586041589259960320,1586041586492002304,2022-10-28 20:05:56 MSK,2022-10-28,20:05:56,+0300,153812887,medvedevrussia,Дмитрий Медведев,,"Либо подготовить им счёт «за всё», что СССР передал Польше в период социализма. А это сотни миллиардов долларов.",ru,[],[],[],126,122,1003,[],[],https://twitter.com/MedvedevRussia/status/1586041589259960320,False,,0,,,,,,,,[],,,,
1586041586492002304,1586041586492002304,2022-10-28 20:05:56 MSK,2022-10-28,20:05:56,+0300,153812887,medvedevrussia,Дмитрий Медведев,,"На польских дегенератов из МИДа, требующих от России компенсации «военных потерь», можно реагировать двояко.",ru,[],[],[],551,358,1755,[],[],https://twitter.com/MedvedevRussia/status/1586041586492002304,False,,0,,,,,,,,[],,,,
1556937444083236866,1556937444083236866,2022-08-09 12:36:27 MSK,2022-08-09,12:36:27,+0300,153812887,medvedevrussia,Дмитрий Медведев,,"После украинского ковёрного очередную нацистскую  хрень в адрес граждан России выдала и эстонская тётка: «Посещение Европы – это привилегия, а не право человека».  Так и хочется ей напомнить другие слова: «То, что вы на свободе, не ваша заслуга, а наша недоработка».",ru,[],[],[],2534,578,2500,[],[],https://twitter.com/MedvedevRussia/status/1556937444083236866,False,,0,,,,,,,,[],,,,
1556897410412150788,1556897410412150788,2022-08-09 09:57:23 MSK,2022-08-09,09:57:23,+0300,153812887,medvedevrussia,Дмитрий Медведев,,Главный украинский клоун предложил «призвать к ответственности всё население России». Последний раз такие идеи в отношении целого народа пытался реализовать Адольф Гитлер. Есть ещё вопросы о природе украинской власти?,ru,[],[],[],1241,508,2143,[],[],https://twitter.com/MedvedevRussia/status/1556897410412150788,False,,0,,,,,,,,[],,,,
1539567900998209536,1539567900998209536,2022-06-22 14:16:06 MSK,2022-06-22,14:16:06,+0300,153812887,medvedevrussia,Дмитрий Медведев,,Вечная память погибшим за Родину  https://t.co/euYfbQLoeW,ru,[],[],[],1137,181,940,[],[],https://twitter.com/MedvedevRussia/status/1539567900998209536,False,,1,https://pbs.twimg.com/ext_tw_video_thumb/1539567707435188224/pu/img/_B6cB8qyEQ4Oo5a_.jpg,,,,,,,[],,,,
1537362563243048962,1537362563243048962,2022-06-16 12:12:52 MSK,2022-06-16,12:12:52,+0300,153812887,medvedevrussia,Дмитрий Медведев,,"Вот любят европейские ценители лягушек, ливера и макарон посещать Киев. Пользы – ноль. Опять пообещали вступление в ЕС, гаубицы старые, хлопнули горилки и поездом, как сто лет назад, – домой. И всё хорошо. Только вот к миру это Украину никак не приближает. А часики тикают…",ru,[],[],[],3024,603,2367,[],[],https://twitter.com/MedvedevRussia/status/1537362563243048962,False,,0,,,,,,,,[],,,,
1535864478658662400,1535864478658662400,2022-06-12 09:00:01 MSK,2022-06-12,09:00:01,+0300,153812887,medvedevrussia,Дмитрий Медведев,,С Днём России!  https://t.co/3HdrRNRcnN,ru,[],[],['https://pbs.twimg.com/media/FU-fAlxX0AAwsdg.jpg'],1449,350,3067,[],[],https://twitter.com/MedvedevRussia/status/1535864478658662400,False,,1,https://pbs.twimg.com/media/FU-fAlxX0AAwsdg.jpg,,,,,,,[],,,,
1532692085836500994,1532692085836500994,2022-06-03 14:54:03 MSK,2022-06-03,14:54:03,+0300,153812887,medvedevrussia,Дмитрий Медведев,,О продовольствии  https://t.co/RdADPEzweJ,ru,[],[],[],434,41,250,[],[],https://twitter.com/MedvedevRussia/status/1532692085836500994,False,,1,https://pbs.twimg.com/ext_tw_video_thumb/1532691550601465858/pu/img/pM0IaRxcBEPYGadc.jpg,,,,,,,[],,,,
1532691123373854721,1532691123373854721,2022-06-03 14:50:14 MSK,2022-06-03,14:50:14,+0300,153812887,medvedevrussia,Дмитрий Медведев,,Мир изменился  https://t.co/JXSmMrbj8J,ru,[],[],[],310,34,253,[],[],https://twitter.com/MedvedevRussia/status/1532691123373854721,False,,1,https://pbs.twimg.com/ext_tw_video_thumb/1532690843999604736/pu/img/oqJZIWfKOv3MBbFN.jpg,,,,,,,[],,,,
1501869893981020160,1501869893981020160,2022-03-10 13:37:40 MSK,2022-03-10,13:37:40,+0300,153812887,medvedevrussia,Дмитрий Медведев,,Наблюдаю за великим исходом иностранных компаний с российского рынка  https://t.co/1TyGiZty0g,ru,[],['https://www.facebook.com/Dmitry.Medvedev/posts/498680784952461'],[],1960,162,890,[],[],https://twitter.com/MedvedevRussia/status/1501869893981020160,False,,0,,,,,,,,[],,,,
1501196334073888772,1501196334073888772,2022-03-08 17:01:11 MSK,2022-03-08,17:01:11,+0300,153812887,medvedevrussia,Дмитрий Медведев,,"С Праздником, дорогие женщины! Любви, счастья и здоровья! #8марта  https://t.co/1895yjMUWX",ru,[],[],[],2235,119,958,['8марта'],[],https://twitter.com/MedvedevRussia/status/1501196334073888772,False,,1,https://pbs.twimg.com/ext_tw_video_thumb/1501194014233665538/pu/img/W3iQxxDlW-Zskqql.jpg,,,,,,,[],,,,
1498618773133221889,1498618773133221889,2022-03-01 14:18:53 MSK,2022-03-01,14:18:53,+0300,153812887,medvedevrussia,Дмитрий Медведев,,"Там какой-то французский министр сегодня сказал, что они объявили нам экономическую войну. Следите за своей речью, господа! И не забывайте, что экономические войны в истории человечества часто перерастали в настоящие",ru,[],[],[],7306,957,3605,[],[],https://twitter.com/MedvedevRussia/status/1498618773133221889,False,,0,,,,,,,,[],,,,
1497493874498936832,1497493874498936832,2022-02-26 11:48:56 MSK,2022-02-26,11:48:56,+0300,153812887,medvedevrussia,Дмитрий Медведев,,Тут санкции ввели против всех членов Совета безопасности России  https://t.co/awtwA4emJt,ru,[],['https://www.facebook.com/Dmitry.Medvedev/posts/491155275705012'],[],2695,181,900,[],[],https://twitter.com/MedvedevRussia/status/1497493874498936832,False,,0,,,,,,,,[],,,,
1496107792331157508,1496107792331157508,2022-02-22 16:01:08 MSK,2022-02-22,16:01:08,+0300,153812887,medvedevrussia,Дмитрий Медведев,,"Канцлер ФРГ Олаф Шольц поручил остановить сертификацию газопровода «Северный поток – 2». Ну что ж. Добро пожаловать в новый мир, в котором уже скоро европейцы будут платить 2000 евро за тысячу кубов газа!",ru,[],[],[],2539,1336,5365,[],[],https://twitter.com/MedvedevRussia/status/1496107792331157508,False,,0,,,,,,,,[],,,,
1487000595169001474,1487000595169001474,2022-01-28 12:52:23 MSK,2022-01-28,12:52:23,+0300,153812887,medvedevrussia,Дмитрий Медведев,,"Ответил на вопросы российских журналистов о международной безопасности, ситуации на Украине, пандемии COVID-19 и другие  https://t.co/Z2vcmM1DWy",ru,[],['https://www.facebook.com/Dmitry.Medvedev/posts/473591460794727'],[],332,39,219,[],[],https://twitter.com/MedvedevRussia/status/1487000595169001474,False,,0,,,,,,,,[],,,,
1476886264968265738,1476886264968265738,2021-12-31 15:01:39 MSK,2021-12-31,15:01:39,+0300,153812887,medvedevrussia,Дмитрий Медведев,,"С Новым, 2022 годом!  https://t.co/R7PUl6h1Gm",ru,[],[],[],778,174,1454,[],[],https://twitter.com/MedvedevRussia/status/1476886264968265738,False,,1,https://pbs.twimg.com/ext_tw_video_thumb/1476886099620474882/pu/img/aTMYqrGDK1bc7E87.jpg,,,,,,,[],,,,
1470785877697773570,1470785877697773570,2021-12-14 19:00:53 MSK,2021-12-14,19:00:53,+0300,153812887,medvedevrussia,Дмитрий Медведев,,"20 лет назад США в одностороннем порядке вышли из Договора об ограничении систем противоракетной обороны, подписанного Москвой и Вашингтоном в 1972 году. Россия сделала всё возможное, чтобы сохранить в силе этот важнейший документ  https://t.co/NhgkWGNvMC",ru,[],['https://www.facebook.com/Dmitry.Medvedev/posts/10158056853706851'],[],201,48,232,[],[],https://twitter.com/MedvedevRussia/status/1470785877697773570,False,,0,,,,,,,,[],,,,
1468175391294734337,1468175391294734337,2021-12-07 14:07:45 MSK,2021-12-07,14:07:45,+0300,153812887,medvedevrussia,Дмитрий Медведев,,Статья @MedvedchukVV заслуживает внимания,ru,"[{'screen_name': 'medvedchukvv', 'name': 'виктор медведчук', 'id': '498708787'}]",[],[],212,31,190,[],[],https://twitter.com/MedvedevRussia/status/1468175391294734337,False,https://twitter.com/MedvedchukVV/status/1467841846814687237,0,,,,,,,,[],,,,
1467175683671666688,1467175683671666688,2021-12-04 19:55:16 MSK,2021-12-04,19:55:16,+0300,153812887,medvedevrussia,Дмитрий Медведев,,"В Москве прошёл третий этап XX съезда Всероссийской политической партии «Единая Россия», который избрал новый состав руководящих органов.  https://t.co/mMWDnkya3i  https://t.co/tdk96wk2yE",ru,[],['https://er.ru/multimedia/video/plenarnoe-zasedanie-tretego-etapa-xx-sezda-edinoj-rossii'],"['https://pbs.twimg.com/media/FFx0d-jX0Acd70q.jpg', 'https://pbs.twimg.com/media/FFx0euWXMAAAxUt.jpg', 'https://pbs.twimg.com/media/FFx0fYzXoAY7ovZ.jpg', 'https://pbs.twimg.com/media/FFx0gMAWYAcNerq.jpg']",187,32,169,[],[],https://twitter.com/MedvedevRussia/status/1467175683671666688,False,,1,https://pbs.twimg.com/media/FFx0d-jX0Acd70q.jpg,,,,,,,[],,,,
1464168027210104834,1464168027210104834,2021-11-26 12:43:55 MSK,2021-11-26,12:43:55,+0300,153812887,medvedevrussia,Дмитрий Медведев,,"Хочу пожелать @lachesisq удачи в матче за звание чемпиона мира против @MagnusCarlsen.  Впереди вас ждёт очень непростая борьба, в которой нужно показать не только свою шахматную силу, но и хладнокровие, терпение и выдержку. Болеем за @lachesisq",ru,"[{'screen_name': 'lachesisq', 'name': 'yan nepomniachtchi', 'id': '431135709'}, {'screen_name': 'magnuscarlsen', 'name': 'magnus carlsen', 'id': '30352096'}, {'screen_name': 'lachesisq', 'name': 'yan nepomniachtchi', 'id': '431135709'}]",[],[],109,29,233,[],[],https://twitter.com/MedvedevRussia/status/1464168027210104834,False,,0,,,,,,,,[],,,,
1455049136366043138,1455049136366043138,2021-11-01 08:48:42 MSK,2021-11-01,08:48:42,+0300,153812887,medvedevrussia,Дмитрий Медведев,,Пандемия новой коронавирусной инфекции COVID-19 стала крупнейшим потрясением последних десятилетий   https://t.co/JxurYPaSdi,ru,[],['https://rg.ru/2021/11/01/dmitrij-medvedev-o-proshlom-nastoiashchem-i-budushchem-borby-s-covid-19.html'],[],361,44,156,[],[],https://twitter.com/MedvedevRussia/status/1455049136366043138,False,,0,,,,,,,,[],,,,
1442743193414553603,1442743193414553603,2021-09-28 09:49:16 MSK,2021-09-28,09:49:16,+0300,153812887,medvedevrussia,Дмитрий Медведев,,Итоги выборов 2021 в интервью телеканалу RT   https://t.co/FmoUXitctG  https://t.co/b4uunxcTms,ru,[],['https://er.ru/activity/news/dmitrij-medvedev-o-vyborah-politicheskoj-konkurencii-i-vliyanii-na-it-gigantov'],"['https://pbs.twimg.com/media/FAWnRHdXoAUi6v3.jpg', 'https://pbs.twimg.com/media/FAWnRH3WUAMMioi.jpg', 'https://pbs.twimg.com/media/FAWnRH8WQAA3fN2.jpg']",253,49,198,[],[],https://twitter.com/MedvedevRussia/status/1442743193414553603,False,,1,https://pbs.twimg.com/media/FAWnRHdXoAUi6v3.jpg,,,,,,,[],,,,
1441826490769936384,1441826490769936384,2021-09-25 21:06:37 MSK,2021-09-25,21:06:37,+0300,153812887,medvedevrussia,Дмитрий Медведев,,Президент РФ высоко оценил результат партии «Единая Россия» на выборах в Государственную Думу  https://t.co/9ai28IxRzE,ru,[],['https://www.facebook.com/Dmitry.Medvedev/posts/10157928729696851'],[],239,38,172,[],[],https://twitter.com/MedvedevRussia/status/1441826490769936384,False,,0,,,,,,,,[],,,,
1436616155779764224,1436616155779764224,2021-09-11 12:02:37 MSK,2021-09-11,12:02:37,+0300,153812887,medvedevrussia,Дмитрий Медведев,,Двадцать лет назад в США был совершён самый кровавый теракт в новейшей истории человечества   https://t.co/5ATXZX52EW,ru,[],['https://www.gazeta.ru/politics/2021/09/10_a_13972880.shtml'],[],182,40,170,[],[],https://twitter.com/MedvedevRussia/status/1436616155779764224,False,,0,,,,,,,,[],,,,
1430762936046399488,1430762936046399488,2021-08-26 08:24:00 MSK,2021-08-26,08:24:00,+0300,153812887,medvedevrussia,Дмитрий Медведев,,"В Москве прошёл второй этап XX съезда всероссийской политической партии «Единая Россия», на котором была утверждена её предвыборная программа  https://t.co/P0lDLZSGgm",ru,[],['https://www.facebook.com/Dmitry.Medvedev/posts/10157881649386851'],[],186,31,135,[],[],https://twitter.com/MedvedevRussia/status/1430762936046399488,False,,0,,,,,,,,[],,,,
1406604612241707012,1406604612241707012,2021-06-20 16:27:27 MSK,2021-06-20,16:27:27,+0300,153812887,medvedevrussia,Дмитрий Медведев,,Поздравляю всех медицинских работников нашей страны с профессиональным праздником #Спасибоврачам  https://t.co/M1hrDlbk17,ru,[],['https://www.facebook.com/Dmitry.Medvedev/videos/599095697706940/'],[],148,46,227,['спасибоврачам'],[],https://twitter.com/MedvedevRussia/status/1406604612241707012,False,,0,,,,,,,,[],,,,
1406310667456585731,1406310667456585731,2021-06-19 20:59:25 MSK,2021-06-19,20:59:25,+0300,153812887,medvedevrussia,Дмитрий Медведев,,В Москве прошёл первый этап 20-го съезда всероссийской политической партии «Единая Россия»  https://t.co/P3cfVTIwCg  https://t.co/ktVLCsMmon,ru,[],['https://er.ru/multimedia/video/plenarnoe-zasedanie-xx-sezda-edinoj-rossii-vystuplenie-v-putin-d-medvedev-a-turchak'],"['https://pbs.twimg.com/media/E4Q3lu4XMAMYNNL.jpg', 'https://pbs.twimg.com/media/E4Q3iqhWUAEhncY.jpg', 'https://pbs.twimg.com/media/E4Q3iqlXEAEjxaM.jpg']",340,60,278,[],[],https://twitter.com/MedvedevRussia/status/1406310667456585731,False,,1,https://pbs.twimg.com/media/E4Q3lu4XMAMYNNL.jpg,,,,,,,[],,,,
1402260349970272272,1402260349970272272,2021-06-08 16:44:54 MSK,2021-06-08,16:44:54,+0300,153812887,medvedevrussia,Дмитрий Медведев,,"Развитие технологий искусственного интеллекта, его влияние на национальную безопасность рассмотрели на совещании с участием коллег из правительства РФ, ведомств и бизнеса  https://t.co/GRYaGstiCe",ru,[],['https://www.facebook.com/175517041850/videos/952080802223858'],[],123,31,121,[],[],https://twitter.com/MedvedevRussia/status/1402260349970272272,False,,0,,,,,,,,[],,,,
1399605461721272323,1399605461721272323,2021-06-01 08:55:20 MSK,2021-06-01,08:55:20,+0300,153812887,medvedevrussia,Дмитрий Медведев,,"С журналистами ИД «Коммерсантъ» поговорили о роли партии «Единая Россия» в политической системе страны, об уроках прошлого и видении будущего, о рейтингах партий и об отношениях России с Западом  https://t.co/eflE9qq2nH",ru,[],['https://www.kommersant.ru/doc/4837620'],[],145,38,120,[],[],https://twitter.com/MedvedevRussia/status/1399605461721272323,False,,0,,,,,,,,[],,,,
1391325089497554945,1391325089497554945,2021-05-09 12:32:05 MSK,2021-05-09,12:32:05,+0300,153812887,medvedevrussia,Дмитрий Медведев,,С праздником! С Днём Великой Победы!  https://t.co/zaW98CqFm6,ru,[],[],"['https://pbs.twimg.com/media/E076wpFWYAcP696.jpg', 'https://pbs.twimg.com/media/E076xboXEAIJbf6.jpg', 'https://pbs.twimg.com/media/E076yPfXsAEkHsp.jpg']",245,103,858,[],[],https://twitter.com/MedvedevRussia/status/1391325089497554945,False,,1,https://pbs.twimg.com/media/E076wpFWYAcP696.jpg,,,,,,,[],,,,
1388793676529295361,1388793676529295361,2021-05-02 12:53:09 MSK,2021-05-02,12:53:09,+0300,153812887,medvedevrussia,Дмитрий Медведев,,Христос Воскресе!  https://t.co/zeJdw6Rup3,uk,[],[],"['https://pbs.twimg.com/media/E0X8Tv0WEAItizc.jpg', 'https://pbs.twimg.com/media/E0X8TvqXoAch6QE.jpg']",212,62,633,[],[],https://twitter.com/MedvedevRussia/status/1388793676529295361,False,,1,https://pbs.twimg.com/media/E0X8Tv0WEAItizc.jpg,,,,,,,[],,,,
1388399745874513924,1388399745874513924,2021-05-01 10:47:49 MSK,2021-05-01,10:47:49,+0300,153812887,medvedevrussia,Дмитрий Медведев,,Хороших майских праздников! Будьте здоровы!  https://t.co/oVU1OYXVmb,ru,[],[],['https://pbs.twimg.com/media/E0SWNWDWUAAhevg.jpg'],296,96,822,[],[],https://twitter.com/MedvedevRussia/status/1388399745874513924,False,,1,https://pbs.twimg.com/media/E0SWNWDWUAAhevg.jpg,,,,,,,[],,,,
1387415792795463686,1387415792795463686,2021-04-28 17:37:56 MSK,2021-04-28,17:37:56,+0300,153812887,medvedevrussia,Дмитрий Медведев,,"Сегодня на #VKLive получился интересный разговор о социальных сетях, о работе в Совбезе, российской внутренней и внешней политике. Благодарю всех, кто прислал свои вопросы.    https://t.co/A7Raft3ris",ru,[],['https://vk.com/wall-179956363_11'],[],64,19,137,['vklive'],[],https://twitter.com/MedvedevRussia/status/1387415792795463686,False,,0,,,,,,,,[],,,,
1386264868324524033,1386264868324524033,2021-04-25 13:24:34 MSK,2021-04-25,13:24:34,+0300,153812887,medvedevrussia,Дмитрий Медведев,,Весна  https://t.co/GWz0ouAtT8,ru,[],[],"['https://pbs.twimg.com/media/Ez0AfjkWUAE_PpA.jpg', 'https://pbs.twimg.com/media/Ez0AfjXX0AENZz7.jpg', 'https://pbs.twimg.com/media/Ez0AfjPX0AAI-BT.jpg']",156,66,562,[],[],https://twitter.com/MedvedevRussia/status/1386264868324524033,False,,1,https://pbs.twimg.com/media/Ez0AfjkWUAE_PpA.jpg,,,,,,,[],,,,
1386224897094033410,1386224897094033410,2021-04-25 10:45:44 MSK,2021-04-25,10:45:44,+0300,153812887,medvedevrussia,Дмитрий Медведев,,"Невыученные уроки истории  Избегание столкновения с большими силами свидетельствует не о трусости, а о мудрости, ибо принесение себя в жертву никогда и нигде не является преимуществом. Сунь Цзы. Искусство войны (из предисловия переводчика акад. Н.И.Конрада) https://t.co/Z3Ues6b28Y",ru,[],['https://ria.ru/20210423/diplomatiya-1729522868.html'],[],147,41,221,[],[],https://twitter.com/MedvedevRussia/status/1386224897094033410,False,,0,,,,,,,,[],,,,
1385859263332077568,1385859263332077568,2021-04-24 10:32:51 MSK,2021-04-24,10:32:51,+0300,153812887,medvedevrussia,Дмитрий Медведев,,28 апреля в 14:00 пройдёт #VKLive с участием Заместителя Председателя Совета Безопасности РФ Дмитрия Медведева.  Вы можете направить свой вопрос в личные сообщения этого сообщества:  https://t.co/OuRZBMhPRh  https://t.co/HIYNmM85yq,ru,[],['http://vk.me/dmlive'],['https://pbs.twimg.com/media/EzuOX8sWQAItrxv.jpg'],104,30,125,['vklive'],[],https://twitter.com/MedvedevRussia/status/1385859263332077568,False,,1,https://pbs.twimg.com/media/EzuOX8sWQAItrxv.jpg,,,,,,,[],,,,
